{
  "artifacts": [
    {
      "kind": "prompt",
      "path": "corpus/phase2/prompts-v1.json",
      "sha256": "d22a007b9e56897b1f34c91f747bedfa05fede012f5e3cd09a900f4bb4749d8b",
      "size": 6171
    },
    {
      "kind": "source-of-truth",
      "path": "docs/MODELS_AND_VALIDATION.md",
      "sha256": "c50561bbb663374231e29d8ddb0863f022b1db2a9e1463ba9b0c04c8a94fac2b",
      "size": 16869
    },
    {
      "kind": "source-of-truth",
      "path": "docs/REPOSITORIES_AND_ARTIFACTS.md",
      "sha256": "0b5e24ed15652b1504f277bdb2bb6cc4d2d1a700b7c9c5524eca7286aae4be69",
      "size": 8571
    },
    {
      "kind": "source-of-truth",
      "path": "docs/STATUS.md",
      "sha256": "a4ebcd7e104c706a8fa8af23d1781ebb4f5b2573bb4d2e96fcfface8a94d5dcc",
      "size": 5672
    },
    {
      "kind": "source-of-truth",
      "path": "docs/plan/00-foundation.md",
      "sha256": "23420e675a79f55fcbec1a076302e7e0ff2b5eabc397044e0fd9d0ac9dcca743",
      "size": 9564
    },
    {
      "kind": "evidence",
      "path": "results/2026-07-29/skynet/phase2-observability/PHASE1.md",
      "sha256": "6be49e416976f1504f5f12fc958da7d265c8f713f983b24494370ef824def57d",
      "size": 3720
    },
    {
      "kind": "evidence",
      "path": "results/2026-07-29/skynet/phase2-observability/PHASE2.md",
      "sha256": "f67c8c225fc3ed41b743cc1da066a4bd5f34b2d3cca1523a56a81d7ea34cc8b7",
      "size": 4873
    },
    {
      "kind": "evidence",
      "path": "results/2026-07-29/skynet/phase2-observability/PHASE3.md",
      "sha256": "2adf1f253d4d323520a9de70df72c8a004b8cedafc7134bd989c8ecfd4db98ca",
      "size": 4076
    },
    {
      "kind": "evidence",
      "path": "results/2026-07-29/skynet/phase2-observability/PHASE4.md",
      "sha256": "5d968cb8f639bdfa326ea1e8e72b1f687b10869e2c33b01565493fa1f09b22a3",
      "size": 4239
    },
    {
      "kind": "evidence",
      "path": "results/2026-07-29/skynet/phase2-observability/phase1-disabled-overhead.json",
      "sha256": "02dc68503d3ff579240bb7cba36c97aca0326a8b60789c675e81d03de920ed28",
      "size": 106151
    },
    {
      "kind": "evidence",
      "path": "results/2026-07-29/skynet/phase2-observability/phase1-numerical/inference.json",
      "sha256": "eb7258a003005e2ecde36557b52c1fce236e62df12cb82bda628f9063622deb2",
      "size": 172774
    },
    {
      "kind": "evidence",
      "path": "results/2026-07-29/skynet/phase2-observability/phase1-route-validation.json",
      "sha256": "0b5b676b35d678a477703025687b899add497b5945559fdc9d84118dbf4b8d62",
      "size": 16081
    },
    {
      "kind": "evidence",
      "path": "results/2026-07-29/skynet/phase2-observability/phase2-f16-expert-storage-map-v1.json",
      "sha256": "42af6acd1d1f2ea77aaa9750b28141670ce69009ba06b5ddca3f42c696b51151",
      "size": 197679
    },
    {
      "kind": "evidence",
      "path": "results/2026-07-29/skynet/phase2-observability/phase2-mxfp4-expert-storage-map-v1.json",
      "sha256": "5efd068823a1746a5b7c1ad6a5fa838803714feadb30f6e28d66431cf7660060",
      "size": 198150
    },
    {
      "kind": "evidence",
      "path": "results/2026-07-29/skynet/phase2-observability/phase2-numerical/inference.json",
      "sha256": "bfab6519a18f746cbd708fe4c31ae8839dffcee6d0ce85e3537395991f296072",
      "size": 172774
    },
    {
      "kind": "evidence",
      "path": "results/2026-07-29/skynet/phase2-observability/phase2-route-regression.json",
      "sha256": "e978e1c4025a0d5d1b84e1cee77aca75533b57c766e83409f8d4335a81aaf4d7",
      "size": 16081
    },
    {
      "kind": "evidence",
      "path": "results/2026-07-29/skynet/phase2-observability/phase2-storage-validation.json",
      "sha256": "f38b7e338a4210cc910d66add8814f384d4ee7f44f58bc84eeb58f940567f961",
      "size": 10384
    },
    {
      "kind": "evidence",
      "path": "results/2026-07-29/skynet/phase2-observability/phase2-trace-enabled-performance.json",
      "sha256": "272d73fae74a6a0c2e4430fa9347ea1dade299b8ac383e47defa1d11ef303a16",
      "size": 29156
    },
    {
      "kind": "evidence",
      "path": "results/2026-07-29/skynet/phase2-observability/phase3-f16-reference-simulation.json",
      "sha256": "ca4ed1c7a7f2d87caf17e1144c22124795e3607e1f187c64d203f02d4dd8f9de",
      "size": 139030
    },
    {
      "kind": "evidence",
      "path": "results/2026-07-29/skynet/phase2-observability/phase3-simulation-manifest-v1.json",
      "sha256": "a08d803db9eeac54aff099eab27a4d3a66fec3eb657be65c469a74aa6e606228",
      "size": 1238
    },
    {
      "kind": "evidence",
      "path": "results/2026-07-29/skynet/phase2-observability/phase4-corpus-capture.json",
      "sha256": "68bd12d796cab98765395acd65fdfe106f51abcc87854cc1e8269644f9c812fe",
      "size": 81961
    },
    {
      "kind": "evidence",
      "path": "results/2026-07-29/skynet/phase2-observability/phase4-corpus-publication.json",
      "sha256": "51f451e21a6162bfec32f3fa572d20e6f8d82d084e10186d5af92024543c9ec7",
      "size": 1466
    },
    {
      "kind": "evidence",
      "path": "results/2026-07-29/skynet/phase2-observability/phase4-corpus-simulations.json",
      "sha256": "b472b001673f97199f02f08706b87630f018837d8142499fe96b9ff8efd2b700",
      "size": 745821
    },
    {
      "kind": "schema",
      "path": "schemas/phase2/cache-simulation-manifest-v1.schema.json",
      "sha256": "996b109135739749e0c5a144c6bbc441b83dcea335b1a1ee933d5e41d840ebd7",
      "size": 2179
    },
    {
      "kind": "schema",
      "path": "schemas/phase2/cache-simulation-output-v1.schema.json",
      "sha256": "2f508c1b24c9908c88a8916cc8d395614dfb73f0970bf32f47623966c264134d",
      "size": 6188
    },
    {
      "kind": "schema",
      "path": "schemas/phase2/cache-simulation-v1.md",
      "sha256": "408630e675799b49dcb414b3218b68eb5f57ea79186eed6a2d71167577130597",
      "size": 2383
    },
    {
      "kind": "schema",
      "path": "schemas/phase2/expert-storage-map-v1.md",
      "sha256": "bf3445f0f71279c88cc3c5426cd3bb7b0b3ae8b8885fce816a85952428139417",
      "size": 1864
    },
    {
      "kind": "schema",
      "path": "schemas/phase2/expert-storage-map-v1.schema.json",
      "sha256": "72e727fde7673acbc9422dc5303dd22d8e6c438bc7c61924ae03f176b23968f5",
      "size": 5248
    },
    {
      "kind": "schema",
      "path": "schemas/phase2/phase2-manifest-v1.schema.json",
      "sha256": "607a9ab621677967e7151eea9c846881b4e4a10d2a5505a825d0d54f2e6c515f",
      "size": 3921
    },
    {
      "kind": "schema",
      "path": "schemas/phase2/route-trace-v1.md",
      "sha256": "90184b865d0a9b0986aad2e6758fcebc78974c90895c00b2402c0edb38308412",
      "size": 1738
    },
    {
      "kind": "implementation",
      "path": "scripts/phase2/cache_simulator.py",
      "sha256": "e3a82ccc72a07716e7c731f935ff59e7e2f48c6b7f8b9ee6100abfa8183d54af",
      "size": 23383
    },
    {
      "kind": "implementation",
      "path": "scripts/phase2/capture_trace_corpus.py",
      "sha256": "64d628ffae34942b5990cc385d2599b04ba257ef651ff7e85305f6651b33aa34",
      "size": 21895
    },
    {
      "kind": "implementation",
      "path": "scripts/phase2/expert_storage_map.py",
      "sha256": "80b4ef78eea1dfdd63b8817aefceb73ce531902091c5275ef4a754871af33cc5",
      "size": 9111
    },
    {
      "kind": "implementation",
      "path": "scripts/phase2/route_trace.py",
      "sha256": "bfd2a6f95fa5c803b137794181f998b721ca96255461a567beb3f6e9f6325190",
      "size": 6817
    },
    {
      "kind": "implementation",
      "path": "scripts/phase2/run_cache_simulation.py",
      "sha256": "96d137e3de6621a94eb25f203b50def262496a2125e957cd29155096d4c4123b",
      "size": 1309
    },
    {
      "kind": "implementation",
      "path": "scripts/phase2/simulate_trace_corpus.py",
      "sha256": "31628646f4dcbfc42bea3eddf0509ac115b7a1bf5d0f9f58ca9dbeac671e1d15",
      "size": 5509
    },
    {
      "kind": "implementation",
      "path": "scripts/phase2/verify_phase2.py",
      "sha256": "d5a94043b68097c2ecca83f8ece1d2b0af5b5978918d04d9b6241f0ed48a0a51",
      "size": 13733
    },
    {
      "kind": "fixture",
      "path": "tests/fixtures/phase2/cache-simulator-reference-v1.json",
      "sha256": "b76c558abdb1bd9bb72ab23db2a86053ee8127566b8f045d946de4173ccc3dc4",
      "size": 2216
    },
    {
      "kind": "fixture",
      "path": "tests/fixtures/phase2/k3-f16-cpu-route-v1.bin",
      "sha256": "1952895f05d7778fa9382e86b9dcaddf1549b330fe5aa034c5418479435111da",
      "size": 19477
    },
    {
      "kind": "test",
      "path": "tests/phase2/test_cache_simulator.py",
      "sha256": "41ae335fdf935f1776eff4012676dcfc3acc4d19af0e8533a54c1a4b1bc9cb73",
      "size": 10333
    },
    {
      "kind": "test",
      "path": "tests/phase2/test_expert_storage_map.py",
      "sha256": "20ee81660ff5eefd5bbfd8786a02837bd6be325a92c214858ac7207d397890ad",
      "size": 2383
    },
    {
      "kind": "test",
      "path": "tests/phase2/test_route_trace.py",
      "sha256": "8bc8d877066e30e8de723358afa211b3e0e68b471774fbef4cd7181990f03f9d",
      "size": 4388
    },
    {
      "kind": "test",
      "path": "tests/phase2/test_route_trace_writer.cpp",
      "sha256": "fb5ca1863693d33069d6522e146eecac0bc2e302ba7347548076bc4d56d52eb9",
      "size": 2906
    }
  ],
  "closeout_state": "checkpoint-b-candidate",
  "execution_profile": "STANDARD",
  "external_archive": {
    "members": [
      {
        "path": "phase2-k3-route-corpus-v1/README.md",
        "sha256": "ce00355490c7bb9a0159fa06ded41750effca4f14edc4aab0b18ef15283c8b98",
        "size": 187
      },
      {
        "path": "phase2-k3-route-corpus-v1/SHA256SUMS",
        "sha256": "c1e58654c39b77c6056cc9b166b8e4054dd5c6e72d58b097f17cdcea47b0d401",
        "size": 1902
      },
      {
        "path": "phase2-k3-route-corpus-v1/corpus-index.json",
        "sha256": "66f6667d3a9d338166cb57dbac8f268ed93fc58372975d2820717ce260b473a1",
        "size": 76878
      },
      {
        "path": "phase2-k3-route-corpus-v1/prompts-v1.json",